{
  "versiRegulasi": "PP-20-2026",
  "berlakuSejak": "2026-04-22",
  "lembaranNegara": "LN RI Tahun 2026 Nomor 43, TLN RI Nomor 7173",
  "statusDokumen": "Terverifikasi terhadap teks asli PP 20/2026, UU 7/2021, UU 36/2008, dan PER-17/PJ/2015 beserta Lampiran I",
  "tanggalVerifikasiTerakhir": "2026-09-05",
  "tahunPajakDidukung": [
    2025,
    2026
  ],
  "lingkupWajibPajak": "ORANG_PRIBADI",
  "kelompokWilayah": {
    "kelompok1": {
      "nama": "10 ibukota provinsi",
      "deskripsi": "Medan, Palembang, Jakarta, Bandung, Semarang, Surabaya, Denpasar, Manado, Makassar, Pontianak"
    },
    "kelompok2": {
      "nama": "Ibukota provinsi lainnya",
      "deskripsi": "Ibukota provinsi selain sepuluh kota pada kelompok 1"
    },
    "kelompok3": {
      "nama": "Daerah lainnya",
      "deskripsi": "Kabupaten atau kota selain ibukota provinsi"
    }
  },
  "parameterPajak": {
    "pphFinal": {
      "tarif": {
        "nilai": 0.005,
        "statusVerifikasi": "TERVERIFIKASI",
        "dasarHukum": [
          {
            "namaRegulasi": "PP No. 20 Tahun 2026",
            "pasalAtauLampiran": "Pasal 56 ayat (2)",
            "fungsi": "Tarif Pajak Penghasilan yang bersifat final sebesar 0,5%",
            "url": "https://jdih.kemenkeu.go.id/dok/pp-20-tahun-2026",
            "statusVerifikasi": "TERVERIFIKASI"
          }
        ]
      },
      "ambangPeredaranBruto": {
        "nilai": 4800000000,
        "operator": "LTE",
        "basisTahun": "TAHUN_PAJAK_SEBELUMNYA",
        "statusVerifikasi": "TERVERIFIKASI",
        "dasarHukum": [
          {
            "namaRegulasi": "PP No. 20 Tahun 2026",
            "pasalAtauLampiran": "Pasal 57 ayat (1)",
            "fungsi": "Batas peredaran bruto tidak melebihi Rp4.800.000.000 dalam 1 Tahun Pajak",
            "url": "https://jdih.kemenkeu.go.id/dok/pp-20-tahun-2026",
            "statusVerifikasi": "TERVERIFIKASI"
          },
          {
            "namaRegulasi": "PP No. 20 Tahun 2026",
            "pasalAtauLampiran": "Pasal 58 ayat (1) huruf a",
            "fungsi": "Peredaran bruto diukur dari Tahun Pajak terakhir sebelum Tahun Pajak bersangkutan",
            "url": "https://jdih.kemenkeu.go.id/dok/pp-20-tahun-2026",
            "statusVerifikasi": "TERVERIFIKASI"
          }
        ]
      },
      "pembebasanOmzetOp": {
        "nilai": 500000000,
        "basisTahun": "TAHUN_PAJAK_BERJALAN",
        "statusVerifikasi": "TERVERIFIKASI",
        "dasarHukum": [
          {
            "namaRegulasi": "UU No. 7 Tahun 2021 (HPP)",
            "pasalAtauLampiran": "Pasal 7 ayat (2a) UU PPh",
            "fungsi": "Bagian peredaran bruto sampai dengan Rp500.000.000 dalam 1 Tahun Pajak tidak dikenai PPh bagi WP orang pribadi",
            "url": "https://jdih.kemenkeu.go.id/dok/uu-7-tahun-2021",
            "statusVerifikasi": "TERVERIFIKASI"
          },
          {
            "namaRegulasi": "PP No. 55 Tahun 2022",
            "pasalAtauLampiran": "Pasal 60",
            "fungsi": "Pelaksanaan pembebasan Rp500.000.000 bagi WP orang pribadi; tidak diubah oleh PP 20/2026",
            "url": "https://jdih.kemenkeu.go.id/dok/pp-55-tahun-2022",
            "statusVerifikasi": "DALAM_REVIEW"
          }
        ]
      }
    },
    "nppn": {
      "ambangPeredaranBruto": {
        "nilai": 4800000000,
        "operator": "LT",
        "basisTahun": "TAHUN_PAJAK_BERJALAN",
        "statusVerifikasi": "TERVERIFIKASI",
        "dasarHukum": [
          {
            "namaRegulasi": "PER-17/PJ/2015",
            "pasalAtauLampiran": "Pasal 1 dan Pasal 2 ayat (1)",
            "fungsi": "Peredaran bruto kurang dari Rp4.800.000.000 dalam 1 tahun wajib pencatatan sehingga dapat memakai Norma",
            "url": "https://pajak.go.id/sites/default/files/2019-03/PER%20-%2017.PJ_.2015.pdf",
            "statusVerifikasi": "TERVERIFIKASI"
          }
        ]
      },
      "batasWaktuPemberitahuan": {
        "keterangan": "paling lama 3 bulan sejak awal Tahun Pajak yang bersangkutan",
        "layananCoretax": "AS.04-01",
        "statusVerifikasi": "TERVERIFIKASI",
        "dasarHukum": [
          {
            "namaRegulasi": "PER-17/PJ/2015",
            "pasalAtauLampiran": "Pasal 2 ayat (1)",
            "fungsi": "Kewajiban memberitahukan penggunaan Norma dalam 3 bulan pertama Tahun Pajak",
            "url": "https://pajak.go.id/sites/default/files/2019-03/PER%20-%2017.PJ_.2015.pdf",
            "statusVerifikasi": "TERVERIFIKASI"
          }
        ]
      }
    },
    "tarifProgresif": {
      "lapisan": [
        {
          "lapisan": 1,
          "batasBawah": 0,
          "batasAtas": 60000000,
          "tarif": 0.05
        },
        {
          "lapisan": 2,
          "batasBawah": 60000000,
          "batasAtas": 250000000,
          "tarif": 0.15
        },
        {
          "lapisan": 3,
          "batasBawah": 250000000,
          "batasAtas": 500000000,
          "tarif": 0.25
        },
        {
          "lapisan": 4,
          "batasBawah": 500000000,
          "batasAtas": 5000000000,
          "tarif": 0.3
        },
        {
          "lapisan": 5,
          "batasBawah": 5000000000,
          "batasAtas": null,
          "tarif": 0.35
        }
      ],
      "statusVerifikasi": "TERVERIFIKASI",
      "dasarHukum": [
        {
          "namaRegulasi": "UU No. 7 Tahun 2021 (HPP)",
          "pasalAtauLampiran": "Pasal 17 ayat (1) huruf a UU PPh",
          "fungsi": "Lapisan tarif progresif Pajak Penghasilan orang pribadi",
          "url": "https://jdih.kemenkeu.go.id/dok/uu-7-tahun-2021",
          "statusVerifikasi": "TERVERIFIKASI"
        }
      ]
    },
    "ptkp": {
      "nilai": {
        "TK/0": 54000000,
        "TK/1": 58500000,
        "TK/2": 63000000,
        "TK/3": 67500000,
        "K/0": 58500000,
        "K/1": 63000000,
        "K/2": 67500000,
        "K/3": 72000000
      },
      "statusVerifikasi": "TERVERIFIKASI",
      "dasarHukum": [
        {
          "namaRegulasi": "UU No. 7 Tahun 2021 (HPP)",
          "pasalAtauLampiran": "Pasal 7 ayat (1) UU PPh",
          "fungsi": "Besaran Penghasilan Tidak Kena Pajak tahunan",
          "url": "https://jdih.kemenkeu.go.id/dok/uu-7-tahun-2021",
          "statusVerifikasi": "TERVERIFIKASI"
        }
      ]
    }
  },
  "aturanKelayakan": {
    "pekerjaanBebas": {
      "kode": "PEKERJAAN_BEBAS",
      "pesanTidakBoleh": "Penghasilan dari jasa sehubungan dengan pekerjaan bebas dikecualikan dari PPh Final 0,5%.",
      "pesanPerluDipastikan": "Profesi ini belum disebut satu per satu dalam daftar pekerjaan bebas, tetapi bisa masuk kategori tenaga ahli atau seniman lainnya. Perlu dipastikan ke DJP.",
      "statusVerifikasi": "TERVERIFIKASI",
      "dasarHukum": [
        {
          "namaRegulasi": "PP No. 20 Tahun 2026",
          "pasalAtauLampiran": "Pasal 56 ayat (3) huruf a jo. ayat (4)",
          "fungsi": "Pengecualian penghasilan dari jasa sehubungan dengan pekerjaan bebas dan daftar jenis pekerjaan bebas",
          "url": "https://jdih.kemenkeu.go.id/dok/pp-20-tahun-2026",
          "statusVerifikasi": "TERVERIFIKASI"
        }
      ]
    },
    "ambangKonsolidasi": {
      "kode": "AMBANG_KONSOLIDASI",
      "pesanTidakBoleh": "Peredaran bruto gabungan pada Tahun Pajak sebelumnya melebihi Rp4.800.000.000.",
      "statusVerifikasi": "TERVERIFIKASI",
      "dasarHukum": [
        {
          "namaRegulasi": "PP No. 20 Tahun 2026",
          "pasalAtauLampiran": "Pasal 57 ayat (2) huruf e",
          "fungsi": "WP orang pribadi beserta seluruh perseroan perorangannya yang peredaran brutonya secara keseluruhan melebihi Rp4.800.000.000 dikecualikan",
          "url": "https://jdih.kemenkeu.go.id/dok/pp-20-tahun-2026",
          "statusVerifikasi": "TERVERIFIKASI"
        }
      ]
    },
    "penggabunganSuamiIstriPisah": {
      "kode": "PENGGABUNGAN_PISAH",
      "pesan": "Untuk pasangan dengan pisah harta atau istri yang menjalankan kewajiban pajaknya sendiri, peredaran bruto suami dan istri digabungkan, termasuk seluruh perseroan perorangan yang mereka dirikan.",
      "statusVerifikasi": "TERVERIFIKASI",
      "dasarHukum": [
        {
          "namaRegulasi": "PP No. 20 Tahun 2026",
          "pasalAtauLampiran": "Pasal 58 ayat (2) dan ayat (3)",
          "fungsi": "Penggabungan peredaran bruto suami-istri dan seluruh perseroan perorangan yang didirikan keduanya",
          "url": "https://jdih.kemenkeu.go.id/dok/pp-20-tahun-2026",
          "statusVerifikasi": "TERVERIFIKASI"
        },
        {
          "namaRegulasi": "UU No. 36 Tahun 2008 (UU PPh)",
          "pasalAtauLampiran": "Pasal 8 ayat (2) dan ayat (4)",
          "fungsi": "Pemisahan pengenaan pajak suami-istri dan penggabungan penghasilan anak yang belum dewasa",
          "url": "https://jdih.kemenkeu.go.id/dok/uu-36-tahun-2008",
          "statusVerifikasi": "TERVERIFIKASI"
        }
      ]
    },
    "penggabunganSuamiIstriGabung": {
      "kode": "PENGGABUNGAN_GABUNG",
      "pesan": "Untuk pasangan yang menjalankan kewajiban pajak secara gabungan, seluruh penghasilan istri dianggap penghasilan suami, kecuali gaji dari satu pemberi kerja yang sudah dipotong PPh 21 dan tidak berhubungan dengan usaha keluarga. Omzet usaha istri tidak termasuk pengecualian itu, sehingga ikut dihitung.",
      "statusVerifikasi": "TERVERIFIKASI",
      "dasarHukum": [
        {
          "namaRegulasi": "UU No. 36 Tahun 2008 (UU PPh)",
          "pasalAtauLampiran": "Pasal 8 ayat (1)",
          "fungsi": "Seluruh penghasilan istri dianggap penghasilan suami, kecuali gaji dari satu pemberi kerja yang telah dipotong PPh Pasal 21",
          "url": "https://jdih.kemenkeu.go.id/dok/uu-36-tahun-2008",
          "statusVerifikasi": "TERVERIFIKASI"
        }
      ]
    },
    "pintuSatuArahTarifUmum": {
      "kode": "PINTU_SATU_ARAH_TARIF_UMUM",